Reference Type,Author,Year,Chapter Title,Book Editor,Book Title,Place Published,Publisher,Volume,Number of Volumes,Page Range,Chapter Number,Edition,Translator,ISBN,DOI,Reprint Edition,WorldCat URL,Publisher URL,Leuven URL,When,What,Where,Who,Abstract,Notes,Notes to Editors,Translated Author,Translated Title,Language
Book Chapter,"Hess, Günther",2006,"Traum des Jacob Balde, Zur Dichter-Ikonographie zwischen Barock und Historismus","Burkard, Thorsten",Jacob Balde im kulturellen Kontext seiner Epoche: Zur 400. Wiederkehr seines Geburtstages,Regensburg,Schnell und Steiner,,,,,,,3795418127|9783795418120,,,http://worldcat.org/oclc/68629409,http://www.schnell-und-steiner.de/artikel_4956.ahtml,,17th century,Literature -- Poetry|Literature -- Literary Criticism -- Iconography|Literature -- History -- Baroque,Europe -- Netherlands,"Balde, Jakob, 1604–1668",,,,,,German
Book Chapter,"Hess, Günther",2006,Die Gräber der Philosophen: Jacob Baldes manieristische Bild-erfindungen und die Kupferstiche zum Poema de vanitate mundi (1638),"Burkard, Thorsten",Jacob Balde im kulturellen Kontext seiner Epoche: Zur 400. Wiederkehr seines Geburtstages,Regensburg,Schnell und Steiner,,,247–286,,,,3795418127|9783795418120,,,http://worldcat.org/oclc/68629409,http://www.schnell-und-steiner.de/artikel_4956.ahtml,,17th century,Literature -- Poetry|Philosophy|Literature -- Sources,Europe -- Netherlands,"Balde, Jakob, 1604–1668",,,,,,German
Book Chapter,"Henrici, Peter",2006,Mission und Mystik im Leben des Seligen Peter Faber,,Church: Her Mission to Peoples and Nations,Rome,Editrice Pontificia Università Gregoriana,,,27–48,,,,8878390704|9788878390706,,,http://worldcat.org/oclc/72439720,,,16th century,Saints and Blessed|Spirituality -- Mysticism|Biography,Europe,"Favre, Pierre, 1506–1546",,,,,,German
Book Chapter,"Henrici, Peter",2006,Hans Urs von Balthasar und der französische Katholizismus,"Kasper, Walter",Logik der Liebe und Herrlichkeit Gottes: Hans Urs von Balthasar im Gespräch; Festgabe für Karl Kardinal Lehmann zum 70. Geburtstag,Mainz,Matthias Grünewald,,,163–175,,,,9783786726012|3786726019,,,http://worldcat.org/oclc/76873651,,,20th century,Theology -- Sources|Biography,Europe,"von Balthasar, Hans Urs, 1905–1988",,,,,,German
Book Chapter,"Henrici, Peter",2006,Die Trilogie Hans Urs von Balthasar als Anregung für die katholische Theologie,"Kasper, Walter",Logik der Liebe und Herrlichkeit Gottes: Hans Urs von Balthasar im Gespräch; Festgabe für Karl Kardinal Lehmann zum 70. Geburtstag,Mainz,Matthias Grünewald,,,339–349,,,,9783786726012|3786726019,,,http://worldcat.org/oclc/76873651,,,20th century,Theology|Writings -- Editions,Europe,"von Balthasar, Hans Urs, 1905–1988",,,,,,German
Book Chapter,"Haub, Rita",2006,'Sancta morte praeoccupatus'. Die Vita des Jesuitenpaters Jacob Balde (1604–1668) nach dem Neuburger Nekrolog,"Burkard, Thorsten",Jacob Balde im kulturellen Kontext seiner Epoche: Zur 400. Wiederkehr seines Geburtstages,Regensburg,Schnell und Steiner,,,363–374,,,,3795418127|9783795418120,,,http://worldcat.org/oclc/68629409,http://www.schnell-und-steiner.de/artikel_4956.ahtml,,17th century,Biography|Writings -- Obituaries,,"Balde, Jakob, 1604–1668",,,,,,German
Book Chapter,"Hamilton, Donna B.",2006,Religion,"Hamilton, Donna B.",A Concise Companion to English Renaissance Literature,"Malden, MA",Blackwell,,,32–53,,,,9781405113588|140511357X|9781405113571|1405113588,,,http://worldcat.org/oclc/62330660,http://www.wiley.com/WileyCDA/WileyTitle/productCd-145113588.html,,16th century|17th century,History -- Regional|Literature,Europe -- UK -- England,,This chapter contains section titled:|References and Further Reading,,,,,English
Book Chapter,"Hamilton, Alastair",2006,Jansenists and Jesuits,,"The Copts and the West, 1439–1822: The European Discovery and the Egyptian Church","Oxford, UK; New York",Oxford University Press,,,152–167,,,,0199288771|9780199288779,,,,https://global.oup.com/academic/product/the-copts-and-the-west-1439-1822-9780199288779?lang=en&cc=us,,17th century|18th century,Controversies -- Jansenism|Foreign Missions -- History -- Regional,Europe,,,,,,,English
Book Chapter,"Hamilton, Alastair",2006,The First Jesuit Mission,,"The Copts and the West, 1439–1822: The European Discovery and the Egyptian Church","Oxford, UK; New York",Oxford University Press,,,58–73,,,,0199288771|9780199288779,,,,https://global.oup.com/academic/product/the-copts-and-the-west-1439-1822-9780199288779?lang=en&cc=us,,16th century|17th century,Foreign Missions -- History -- Regional,Africa -- Egypt,,,,,,,English
Book Chapter,"Hamilton, Alastair",2006,Athanasius Kircher and His Shadow,,"The Copts and the West, 1439–1822: The European Discovery and the Egyptian Church",Oxford; New York,Oxford University Press,,,195–228,,,,0199288771|9780199288779,,,,https://global.oup.com/academic/product/the-copts-and-the-west-1439-1822-9780199288779?lang=en&cc=u,,17th century,Biography|Sciences -- Egyptology|Coptics,Europe,"Kircher, Athanasius, 1602–1680",,,,,,English
Book Chapter,"Haight, Roger",2006,Ecclesiology from Below: Principles from Ignacio Ellacuría,"Burke, Kevin F.|Lassalle-Klein, Robert",Love that Produces Hope: The Thought of Ignacio Ellacuría,"Collegeville, MN",Liturgical Press,,,187–204,,,,0814652174|9780814652176,,,http://worldcat.org/oclc/56510720,https://www.litpress.org/Detail.aspx?ISBN=814652174,,20th century,Theology -- Ecclesiology,North America -- El Salvador,"Ellacuría, Ignacio, 1930–1989|Haight, Roger, 1936–",,,,,,English
Book Chapter,"Haas, Alois M.",2006,Hans Urs von Balthasar Nietzschebild: Eine Problemskizze,"Kasper, Walter",Logik der Liebe und Herrlichkeit Gottes: Hans Urs von Balthasar im Gespräch; Festgabe für Karl Kardinal Lehmann zum 70. Geburtstag,Mainz,Matthias Grünewald,,,146–162,,,,9783786726012|3786726019,,,http://worldcat.org/oclc/76873651,,,20th century,Theology -- Sources|Philosophy -- Nihilism,Europe,"von Balthasar, Hans Urs, 1905–1988",,,,,,German
Book Chapter,"Gutiérrez, Alberto",2006,San Pedro Claver: Precursor de la defensa de los derechos humanos,,Church: Her Mission to Peoples and Nations,Rome,Editrice Pontificia Università gregoriana,,,49–62,,,,8878390704|9788878390706,,,http://worldcat.org/oclc/72439720,,,17th century,Foreign Missions -- Biography|Foreign Missions -- Politics -- Human Rights|Saints and Blessed,South America|Europe,"Claver, Pedro, Saint, 1580–1654",,,,,,Spanish
Book Chapter,"Greshake, Gisbert",2006,Eschatologie in den Geistlichen Übungen des Ignatius von Loyola,"Gertler, Thomas|Kessler, Stephen C.|Lambert, Willi",Zur grösseren Ehre Gottes: Ignatius von Loyola neu entdeckt für die Theologie der Gegenwart,Freiburg im Breisgau,Herder,,,310–329,,,,9783451289446|345128944X,,,http://worldcat.org/oclc/76808973,,,16th century,Theology -- Eschatology|Ignatius of Loyola -- Spirituality,Europe,"Ignatius, of Loyola, Saint, c.1491–1556",,,,,,German
Book Chapter,"Grendler, Paul F.",2006,Italian Schools and University Dreams during Mercurian’s Generalate,,Renaissance Education between Religion and Politics,"Aldershot, UK; Burlington, VT",Ashgate; Variorum,,,483–522,,,,0860789896|9780860789895,,,http://worldcat.org/oclc/62892234,https://www.routledge.com/Renaissance-Education-Between-Religion-and-Politics/Grendler/p/book/97886789895,,16th century,Education -- Colleges -- History -- Regional|Education -- Policies|Government -- Generals -- Everard Mercurian,Europe -- Italy,"Mercurian, Everard, 1514–1580","Few eras took education so seriously or were so innovative in their approaches to schools and universities as the Renaissance. At the same time, religious and political concerns strongly influenced educational developments. This third volume of articles by Paul F. Grendler explores the close connections between education, religion, and politics at several levels and in different contexts. It combines detailed research into various kinds of schools with broad overviews of European and especially Italian education. The lead article compares Italian and German universities and assesses the impact of the Protestant Reformation on the latter. Even Erasmus, the great critic of university theologians, felt the need to acquire a doctorate in theology and did so. In Italy, the new schools of the Jesuits and the Piarists taught boys and young men gratis, but not without opposition. Two articles deal with students, the consumers of education. While teachers and students were most directly involved in schools and universities, ecclesiastical and political authorities, including the leaders of the Republic of Venice, the subject of the final study, kept a watchful eye on them.",,,,,English
Book Chapter,"Greisch, Jean",2006,Eine phänomenologische Wende der Theologie?,"Kasper, Walter",Logik der Liebe und Herrlichkeit Gottes: Hans Urs von Balthasar im Gespräch; Festgabe für Karl Kardinal Lehmann zum 70. Geburtstag,Mainz,Matthias Grünewald,,,371–385,,,,9783786726012|3786726019,,,http://worldcat.org/oclc/76873651,,,20th century,Theology|Philosophy -- Phenomenology,Europe,"von Balthasar, Hans Urs, 1905–1988",,,,,,German
Book Chapter,"Greer, Allan",2006,Comparisons: New France,"Vickers, Daniel",A Companion to Colonial America,"Oxford; Malden, MA",Blackwell,,,469–488,,2nd,,9781405165693|1405165693|9781405149853|140514985X|9780470998496|0470998490|9780470998489|0470998482,,,http://worldcat.org/oclc/244174844,http://www.wiley.com/WileyCDA/WileyTitle/productCd-14514985X.html,,17th century|18th century,Foreign Missions -- History -- Regional|Foreign Missions -- Colonialism,North America -- Canada --  Québec,"Charlevoix, Pierre-François-Xavier de, 1682–1761",This chapter contains sections titled: Overviews; French Exploration; Colonial Encounters; Social History; Gender; The Colonial State; War; Conclusion,,,,,English
Book Chapter,"Grasso, Kenneth L.",2006,"An Unfinished Argument: Dignitatis Humanae, John Courtney Murray, and the Catholic Theory of the State","Grasso, Kenneth L.|Hunt, Robert P.",Catholicism and Religious Freedom: Contemporary Reflections on Vatican II's Declaration on Religious Liberty,"Lanham, MD",Sheed & Ward,,,,8,,,074255192X|9780742551923|0742551938|9780742551930,,,http://worldcat.org/oclc/69680010,https://rowman.com/ISBN/97874255193/Catholicism-and-Religious-Freedom-Contemporary-Reflections-on-Vatican-IIs-Declaration-on-Religious-Liberty,,20th century,Political Thought|Theology -- Religious Freedom|Councils -- Vatican II -- Declarations,North America -- USA|Europe -- Italy -- Rome,"Murray, John Courtney, 1904–1967",,,,,,English
Book Chapter,"Gracia, Joaquín",2006,Los jesuitas en Córdoba: Desde la Colonia hasta la Segunda Guerra Mundial,,Colección Jesuitas,"Cordoba, Argentina",Editorial de la Universidad Católica de Córdoba,2: 1626–1700,,188,,,,9871203756|9789871203758,,,http://worldcat.org/oclc/494841144,,,17th century,Foreign Missions -- Education -- Colleges -- History -- Local|Foreign Missions -- History -- Local,South America -- Argentina -- Córdoba,,,,,,,Spanish
Book Chapter,"González, Antonio",2006,Assessing the Philosophical Achievement of Ignacio Ellacuría,"Burke, Kevin F.|Lassalle-Klein, Robert",Love that Produces Hope: The Thought of Ignacio Ellacuría,"Collegeville, MN",Liturgical Press,,,73–87,,,,0814652174|9780814652176,,,http://worldcat.org/oclc/56510720,https://www.litpress.org/Detail.aspx?ISBN=814652174,,20th century,Philosophy|Biography,North America -- El Salvador,"Ellacuría, Ignacio, 1930–1989",,,,,,English
Book Chapter,"Gertler, Thomas",2006,Exerzitien als Exempel evangelisierender Verkündigung,"Gertler, Thomas|Kessler, Stephen C.|Lambert, Willi",Zur grösseren Ehre Gottes: Ignatius von Loyola neu entdeckt für die Theologie der Gegenwart,Freiburg im Breisgau,Herder,,,254–269,,,,9783451289446|345128944X,,,http://worldcat.org/oclc/76808973,,,16th century|17th century|18th century|19th century|20th century|21st century,Ignatius of Loyola -- Spiritual Exercises|Evangelization -- Strategies,,"Ignatius, of Loyola, Saint, c.1491–1556",,,,,,German
Book Chapter,"Gemert, Guillaume Van",2006,Balde und die Niederlande - die Niederlande und Balde. Marginalien zum editorischen Schicksal der Sylven-Biicher acht und neun,"Burkard, Thorsten",Jacob Balde im kulturellen Kontext seiner Epoche: Zur 400. Wiederkehr seines Geburtstages,Regensburg,Schnell und Steiner,,,375–389,,,,3795418127|9783795418120,,,http://worldcat.org/oclc/68629409,http://www.schnell-und-steiner.de/artikel_4956.ahtml,,17th century,Literature -- Poetry|Biography -- Intellectual|Arts -- Theater -- Drama,Europe -- Netherlands,"Balde, Jakob, 1604–1668",,,,,,German
Book Chapter,"Gausti, Niccolò",2006,"I gesuiti spagnoli espulsi (1767–1815): Politica, economia, cultura","Bianchini, Paolo","Morte e resurrezione di un ordine religioso: Le strategie culturali ed educative della Compagnia di Gesù durante la soppressione, 1759–1814",Milan,Vita e Pensiero,,,15–52,,,,8834312872|9788834312872,,,http://worldcat.org/oclc/66372725,http://www.vitaepensiero.it/scheda-libro/autori-vari/morte-e-resurrezione-di-un-ordine-religioso-9788834312872-14159.html,,18th century|19th century,History -- Regional -- Expulsion|Politics|Economics,Europe -- Spain,,,,,,,Italian
Book Chapter,"Garon, Henry A.",2006,Teilhard's Divine Milieu,,The Cosmic Mystique,"Maryknoll, NY",Orbis Books,,,150–155,,,,1570756325|9781570756320,,,http://worldcat.org/oclc/61879640,http://www.orbisbooks.com/the-cosmic-mystique.html,,20th century,Theology -- Cosmology,,"Teilhard de Chardin, Pierre, 1881–1955",,,,,,English
Book Chapter,"Garcia-Mateo, Rogelio",2006,Hat der Mystiker die Theologie nötig? Zur Relevanz der philosophisch-theologischen Studien bei Ignatius von Loyola,"Gertler, Thomas|Kessler, Stephen C.|Lambert, Willi",Zur grösseren Ehre Gottes: Ignatius von Loyola neu entdeckt für die Theologie der Gegenwart,Freiburg im Breisgau,Herder,,,12–34,,,,9783451289446|345128944X,,,http://worldcat.org/oclc/76808973,,,16th century,Ignatius of Loyola -- Theology |Ignatius of Loyola -- Spirituality -- Mysticism|Historiography -- Ignatius of Loyola,Europe,"Ignatius, of Loyola, Saint, c.1491–1556",,,,,,German
Book Chapter,"García Gutiérrez, Fernando",2006,Europa descubre el Extremo Oriente: los viajes de Francisco Javier (1506–1552),"Plazaola, Juan","Jesuitas exploradores, pioneros y geógrafos",Bilbao,Instituto Ignacio de Loyola; Ediciones Mensajero,,,19–35,1,,,842712743X|9788427127432,,,http://worldcat.org/oclc/69673507,,,16th century,Foreign Missions -- Travel|Foreign Missions -- Biography|Saints and Blessed,Asia,"Francis Xavier, Saint, 1506–1552",,,,,,Spanish
Book Chapter,"García Gutiérrez, Fernando",2006,No One Takes My Life from Me: I Give It Freely,"Burke, Kevin F.|Lassalle-Klein, Robert",Love that Produces Hope: The Thought of Ignacio Ellacuría,"Collegeville, MN",Liturgical Press,,,68–72,,,,0814652174|9780814652176,,,http://worldcat.org/oclc/56510720,https://www.litpress.org/Detail.aspx?ISBN=814652174,,20th century,Spirituality|Theology -- Christian Life|Theology -- Politics,North America -- El Salvador,"Ellacuría, Ignacio, 1930–1989",,,,,,English
Book Chapter,"Fumaroli, Marc",2006,Eloquence sacrée et littérature: L’Essay des merveilles d’Étienne Binet,,Exercices de lecture: De Rabelais à Paul Valéry,Paris,Gallimard,,,62–110,,,,2070729850|9782070729852,,,http://worldcat.org/oclc/65201892,http://www.gallimard.fr/Catalogue/GALLIMARD/Bibliotheque-des-Idees/Exercices-de-lecture,,17th century,Literature -- Sacred Literature|Writings -- Encyclopedias|Arts -- Rhetoric -- Sources,Europe -- France,"Binet, Etienne, 1569–1639",,,,,,French
Book Chapter,"Fumaroli, Marc",2006,Between the Rigorist Hammer and the Deist Anvil: The Fate of the Jesuits in Eighteenth-Century France,"O'Malley, John|Bailey, Gauvin Alexander|Harris, Steven J.|Kennedy, T. Frank","The Jesuits II: Cultures, Sciences and the Arts, 1540–1773","Toronto; Buffalo, NY; London",University of Toronto Press,,,682–690,,,,0802038611|9780802038616,,,http://worldcat.org/oclc/799994154,http://www.utppublishing.com/The-Jesuits-II-Cultures-Sciences-and-the-Arts-154-1773.html,,18th century,History -- Regional|History -- History of Religion,Europe -- France,,,,,,,English
Book Chapter,"Führer, Heidrun",2006,Abrahams und Jephtes Menschenopfer in den jesuitischen Schuldramen von Jacob Pontanus und Jacob Balde: Ne dubita; Oboedire Deo nil affert mali,"Steiger, Johann Anselm|Heinen, Ulrich",Isaaks Opferung (Gen 22) in den Konfessionen und Medien der Frühen Neuzeit,Berlin; New York,De Gruyter,,,659–691,,,,9783110200850|3110200856,,,,https://lup.lub.lu.se/search/publication/789250|http://www.degruyter.com/view/product/379?format=G,,17th century,Education -- Colleges -- Arts -- Theater -- Drama|Theology -- Scripture,Europe -- Germany,"Balde, Jakob, 1604–1668|Pontanus, Jacob, 1542–1626",,"Paper presented on March 2005, Johannes a Lasco-Bibliothek, Emden.",,,,German
Book Chapter,"Fraschina, Alicia",2006,"A Jesuit Beata at the Time of the Suppression in the Viceroyalty of Río de la Plata: María Antoine de Paz y Figueroa, 1730–1799","O'Malley, John|Bailey, Gauvin Alexander|Harris, Steven J.|Kennedy, T. Frank","The Jesuits II: Cultures, Sciences and the Arts, 1540–1773","Toronto; Buffalo, NY; London",University of Toronto Press,,,758–771,,,,0802038611|9780802038616,,,http://worldcat.org/oclc/799994154,http://www.utppublishing.com/The-Jesuits-II-Cultures-Sciences-and-the-Arts-154-1773.html,,18th century,Foreign Missions -- Saints and Blessed -- Women |Foreign Missions -- History -- Regional -- Suppression|Foreign Missions -- Biography,South America -- Argentina -- Río de la Plata,,,,,,,English
Book Chapter,"Francisco, José Mario C.|Jesus, Roman Miguel G. de",2006,Introduction,"Francisco, Jose Mario C.|Jesus, Roman Miguel G. de",Science and Religion and Culture in the Jesuit Tradition: Perspective from East Asia,"Hindmarsh, Australia",ATF Press,,,1–6,,,,1920691359|9781920691356,,,http://worldcat.org/oclc/70928934,http://atfpress.com/science-and-religion-and-culture-in-the-jesuit-tradition-perspective-from-east-asia.html,,21st century,Theology -- Controversies -- Science|Theology -- Epistemology,,,,,,,,English
Book Chapter,"Francisco, José Mario C.",2006,"Too Much 'Soul': Points and Counterpoints from Culture, Theology and Science","Francisco, Jose Mario C.|Jesus, Roman Miguel G. de",Science and Religion and Culture in the Jesuit Tradition: Perspective from East Asia,"Hindmarsh, Australia",ATF Press,,,135–156,,,,1920691359|9781920691356,,,http://worldcat.org/oclc/70928934,http://atfpress.com/science-and-religion-and-culture-in-the-jesuit-tradition-perspective-from-east-asia.html,,21st century,Theology -- Controversies -- Science|Theology -- Epistemology,,,,,,,,English
Book Chapter,"Francisco, José Mario C.",2006,Popular Perceptions of Science and Religion: Implications for the Science and Religion Dialogue,"Francisco, Jose Mario C.|Jesus, Roman Miguel G. de",Science and Religion and Culture in the Jesuit Tradition: Perspective from East Asia,"Hindmarsh, Australia",ATF Press,,,49–66,,,,1920691359|9781920691356,,,http://worldcat.org/oclc/70928934,http://atfpress.com/science-and-religion-and-culture-in-the-jesuit-tradition-perspective-from-east-asia.html,,20th century|21st century,Theology -- Science|Sociology,,,,,,,,English
Book Chapter,"Foucault, Michel",2006,Four: 28 November 1973,"Lagrange, Jacques","Psychiatric Power: Lectures at the Collège de France, 1973–74",New York,Picador,,,,,,"Burchell, Graham",9780312203313|0312203314,,,http://worldcat.org/oclc/681911155,,,17th century|18th century,Historiography |Foreign Missions -- Strategies|Education -- Identity|Ministries |Writings -- Lectures,South America -- Paraguay,,Elements for a history of disciplinary apparatuses: religious communities in the Middle Ages; pedagogical colonization of youth; the Jesuit missions to Paraguay; the army; workshops; workers' cities. ~ The formalization of these apparatuses in Jeremy Bentham's model of the Panopticon. ~ The family institution and emergence of the Psy-function.,"Originally published as: Le pouvoir psychiatrique. Seuil/Gallimard, 2003. In series Hautes études.|Translated from the French.",,,,English
Book Chapter,"Fiorenza, Francis Schüssler",2006,Karl Rahner: A Theologian for a Cosmopolitan Twenty-First Century,"Skira, Jaroslav Z.|Attridge, Michael S.","In God's Hands: Essays on the Church and Ecumenism in Honour of Michael A. Fahey, S.J",Leuven,Leuven University Press,,,109–135,7,,,9042918306|9789042918306|9058675750|9789058675750,,,http://worldcat.org/oclc/76942377,,,20th century|21st century,Theology|Biography,Europe,"Rahner, Karl, 1904–1984",,,,,,English
Book Chapter,"Filippi, Bruna",2006,"The Orator's Performance: Gesture, Word, and Image in Theatre at the Collegio Romano","O'Malley, John|Bailey, Gauvin Alexander|Harris, Steven J.|Kennedy, T. Frank","The Jesuits II: Cultures, Sciences and the Arts, 1540–1773","Toronto; Buffalo, NY",University of Toronto Press,2,,512–529,,,,0802038611|9780802038616,,,http://worldcat.org/oclc/799994154,http://www.utppublishing.com/The-Jesuits-II-Cultures-Sciences-and-the-Arts-154-1773.html,,16th century|17th century|18th century,Education -- Colleges -- Arts -- Theater|History -- Local|Arts -- Rhetoric,Europe -- Italy -- Rome,,,,,,,English
Book Chapter,"Fijen, Leo|Bolsius, Marc",2006,Hoe een jezuïet trappist werd,"Oussoren, Pieter|Willigenberg, Theo van",Goudzoekers: Portretten uit Abdij Koningshoeven,Vught,Skandalon,,,234–235,,,,907656423X|9789076564234,,,http://worldcat.org/oclc/193674037,,,20th century,Biography|History -- Local|Arts -- Painting -- Portraits,Europe -- Netherlands,"Kun, Joseph Ignatius Maria van der, 1899–1981",,,,,,Dutch
Book Chapter,"Farrington, Karen",2006,Jesuit-Missionaries Abroad,,Historical Atlas of Religions,London,Mercury,,,,,,,1904668135|9781904668138,,,http://worldcat.org/oclc/63137369,,,16th century|17th century|18th century,Foreign Missions -- History -- General,,,"From the Publisher: From the dawn of mankind's imagination, we have sought the favour of elemental powers and attempted to appease them with worship and sacrifice. The story of religion is one of learning to live with evolving social structures and determining how faith can provide a structure of beliefs through which we can deal with the world around us. In Historical Atlas of Religions, Karen Farrington shows how different cultures' beliefs evolved, how their influence spread, and where they came into conflict with each other. The book is not partisan; its aims are to enlighten and not to preach, and to put each religion into its own proper context. Historical Atlas of Religions is a delightful encyclopedia of human spiritual endeavor from the earliest forms of animism to the established faiths of modern times.",,,,,English
Book Chapter,"Fabre, Pierre-Antoine",2006,"Essai de géopolitique des courants spirituels: Alonso Sánchez entre Madrid, le Mexique, les Iles Philippines, les côtes de la Chine et Rome (1579–1593)","Broggio, Paolo","Strategie politiche e religiose nel mondo moderno: La Compagnia di Gesù ai tempi di Claudio Acquaviva, 1581–1615: atti delle giornate di studi, Roma, École française de Rome, 28–29 ottobre 2002",Rome,Aracne,,,15–36,,,,8879997343|9788879997348,10.1400/89824,,http://worldcat.org/oclc/131094990,,,16th century,Foreign Missions -- Spirituality|Spirituality |Biography|Politics,Europe -- Spain -- Madrid|Asia -- Philippines|North America -- Mexico|Asia -- China,"Sánchez, Alonso, 1547–1593|Acquaviva, Claudio, 1543–1615",,,,,,French
Book Chapter,"Extremera Tapia, Nicolás",2006,O diálogo das línguas no teatro de Anchieta,"Mendonça Teles, Gilberto",Diálogos Ibero-Americanos,Rio de Janeiro,Edições Galo Branco,2,,142–162,,,,9788577490059|857749005X,,,http://worldcat.org/oclc/276406078,,,16th century,Foreign Missions -- Arts -- Theater|Foreign Missions -- Linguistics,South America -- Brazil,"Anchieta, José de, 1534–1597",,,,,,Portuguese
Book Chapter,"Enders, Markus",2006,Die Schönheit der Seinsordnung im Licht der Herrlichkeit Gottes: Die exemplarische Synthese zwischen heidnisch-antiker Ästhetik und der Herrlichkeit des biblischen Gottes im philosophischen Denken des Thomas von Aquin nach Hans Urs von Balthasar,"Kasper, Walter",Logik der Liebe und Herrlichkeit Gottes: Hans Urs von Balthasar im Gespräch; Festgabe für Karl Kardinal Lehmann zum 70. Geburtstag,Mainz,Matthias Grünewald,,,76–92,,,,9783786726012|3786726019,,,http://worldcat.org/oclc/76873651,,,20th century,Theology -- Aesthetics|Theology -- Scripture|Theology -- Philosophy,Europe,"von Balthasar, Hans Urs, 1905–1988",,,,,,German
Book Chapter,"Enders, Markus",2006,Alle weltliche Schönheit ist für den antiken Menschen die Epiphanie göttlicher Herrlichkeit: Zur vorchristlichen Wahrnehmung des Schönen in der heidnischen Antike nach Hans Urs von Balthasar,"Kasper, Walter",Logik der Liebe und Herrlichkeit Gottes: Hans Urs von Balthasar im Gespräch; Festgabe für Karl Kardinal Lehmann zum 70. Geburtstag,Mainz,Matthias Grünewald,,,26–44,,,,9783786726012|3786726019,,,http://worldcat.org/oclc/76873651,,,20th century,Theology -- Aesthetics|Theology -- Scripture|Theology -- Method,Europe,"von Balthasar, Hans Urs, 1905–1988",,,,,,German
Book Chapter,"Endean, Philip",2006,John Macquarrie and Karl Rahner,"Morgan, Robert",In Search of Humanity and Deity: A Celebration of John Macquarrie's Theology,London,SCM Press,,,,9,,,0334040493|9780334040491,,,http://worldcat.org/oclc/74215775,,,20th century,Theology|Biography,Europe,"Rahner, Karl, 1904–1984",,,,,,English
