Reference Type,Author,Year,Chapter Title,Book Editor,Book Title,Place Published,Publisher,Volume,Number of Volumes,Page Range,Chapter Number,Edition,Translator,ISBN,DOI,Reprint Edition,WorldCat URL,Publisher URL,Leuven URL,When,What,Where,Who,Abstract,Notes,Notes to Editors,Translated Author,Translated Title,Language
Book Chapter,"Olson, Richard",2006,Jesuit Science,,"Science and Religion, 1450–1900: From Copernicus to Darwin",Baltimore,Johns Hopkins University Press,,,,,,,0801884004|9780801884009,,,http://worldcat.org/oclc/68731202,,,16th century|17th century|18th century,Sciences -- History of Science,,,"Galileo, Newton, Darwin. These giants are remembered for their contributions to science. Often forgotten, however, is the profound influence that Christianity had on their lives and work. This study explores the many ways in which religion - its ideas, attitudes, practices, and institutions - interacted with science from the beginnings of the scientific revolution to the end of the nineteenth century -- BOOK JACKET.","Originally published: Westport, CT: Greenwood Press, 2004.",,,,English
Book Chapter,"Oïffer-Bomsel, Alicia",2006,Vision de la nature et de l'homme dans la Curiosa y oculta filosofía (1643) de Juan Eusebio Nieremberg,"Fourtané, Nicole|Guiraud, Michèle",L'identité culturelle dans le monde luso-hispanophone,Nancy,Presses universitaires de Nancy,,,383–396,,,,2864808579|9782864808572,,,http://worldcat.org/oclc/469973857,,,17th century,Philosophy -- Anthropology|Philosophy -- Natural Philosophy,South America,"Nieremberg, Juan Eusebio, 1595–1658",,"Essay in conference proceedings of the Colloque international Approche pluri-disciplinaire de l'identité culturelle dans le monde luso-hispanophone, Université Nancy 2, 10 and 11 December 2004.",,,,French
Book Chapter,"Odekon, Mehmet",2006,The Jesuits,,Encyclopedia of World Poverty,"Thousand Oaks, CA",SAGE Publications,,,,,,,1412939607|9781412939607,,,http://worldcat.org/oclc/162127125,,,21st century,History -- General|Writings -- Encyclopedias,,,"The three volumes of this encyclopedia contain over 800 original articles written by more than 125 renowned scholars. The entries contributing to this work explore poverty in various regions of the world, and examine the difficulties associated with the definition and measurement of poverty, along with its causes and effects.",,,,,English
Book Chapter,"O'Banion, Patrick J.",2006,'A Priest Who Appears Good': Manuals of Confession and the Construction of Clerical Identity in Early Modern Spain,"Janse, Wim|Pitkin, Barbara",The Formation of Clerical and Confessional Identities in Early Modern Europe,Leiden,Brill,,,,20,,,9004149090|9789004149090,,,http://worldcat.org/oclc/62500876,,,16th century|17th century,Theology -- Moral|Ministries -- Confession|Writings -- Manuals,Europe -- Spain,,,,,,,English
Book Chapter,"Oakes, Edward T.",2006,'He Descended into Hell': The Depths of God's Self-Emptying Love on Holy Saturday in the Thought of Hans Urs von Balthasar,"Evans, C. Stephen",Exploring Kenotic Christology: The Self-Emptying of God,Oxford,Oxford University Press,,,,9,,,0199283222|9780199283224,,,http://worldcat.org/oclc/63702628,,,20th century,Theology -- Christology|Theology -- Scripture,,"von Balthasar, Hans Urs, 1905–1988",,,,,,English
Book Chapter,"Nelles, Paul",2006,"The Measure of Rome: Justus Lipsius, André Schott, and the Reception of the Res gestae divi Augusti","Ligota, Christopher R.|Quantin, Jean-Louis",History of Scholarship: A Selection of Papers from the Seminar on the History of Scholarship Held Annually at the Warburg Institute,Oxford,Oxford University Press,,,113–134,3,,,9780191515835|0191515833|1280757981|9781280757983,,,http://worldcat.org/oclc/77176117,https://global.oup.com/academic/product/history-of-scholarship-978199284313?cc=us&lang=en&,,17th century,Philology |Historiography,Europe -- Italy -- Rome,"Schott, André, 1552–1629",,,,,,German
Book Chapter,"Nebres, Bienvenido F.",2006,The Philippine Path to Modernisation: The Role of Religion and the Contribution of Science,"Francisco, Jose Mario C.|Jesus, Roman Miguel G. de",Science and Religion and Culture in the Jesuit Tradition: Perspective from East Asia,"Hindmarsh, Australia",ATF Press,,,67–80,,,,1920691359|9781920691356,,,http://worldcat.org/oclc/70928934,http://atfpress.com/science-and-religion-and-culture-in-the-jesuit-tradition-perspective-from-east-asia.html,,20th century|21st century,Foreign Missions -- History -- Regional|Foreign Missions -- Sciences|Foreign Missions -- Politics,Asia -- Philippines,,,,,,,English
Book Chapter,"Navarro Brotóns, Víctor",2006,Science and Enlightenment in Eighteenth-Century Spain: The Contribution of the Jesuits Before and After the Expulsion,"O'Malley, John W.|Bailey, Gauvin Alexander|Harris, Steven J.|Kennedy, T. Frank","The Jesuits II: Cultures, Sciences, and the Arts, 1540–1773",Toronto,University of Toronto Press,,,390–404,,,,9780802038616|0802038611,,,http://worldcat.org/oclc/367474071,http://www.utppublishing.com/The-Jesuits-II-Cultures-Sciences-and-the-Arts-154-1773.html,,18th century,Sciences -- History of Science|History -- Regional -- Expulsion|Enlightenment,Europe -- Spain,,,Essay originally presented as papers at a conference held in 2002.,,,,English
Book Chapter,"Murre-Van den Berg, H. L.",2006,"'Simply by Giving to Them Maccaroni…': Anti-Roman Catholic Polemics in Early Protestant Missions in the Middle East, 1820–1860","Tamcke, Martin|Marten, Michael",Christian Witness between Continuity and New Beginnings: Modern Historical Missions in the Middle East,"Münster; Piscataway, NJ",Lit; Transcation Publishers,,,63–80,,,,9783825898540|3825898547,,,http://worldcat.org/oclc/78203325,http://www.lit-verlag.de/isbn/3-8258-9854-7,,19th century,Foreign Missions -- Controversies -- Anti-Jesuitism|Foreign Missions -- Protestantism|Foreign Missions -- Propaganda,Asia -- Middle East,,,"Paper presented at the Mainz, Germany, ""Modern Historical Missions to the Middle East,"" First World Congress of Middle Eastern Studies, September 2002.",,,,English
Book Chapter,"Muller, Jeffrey M.",2006,Jesuits Uses of Art in the Province of Flanders,"O'Malley, John W.|Bailey, Gauvin Alexander|Harris, Steven J.|Kennedy, T. Frank","The Jesuits II: Cultures, Sciences, and the Arts, 1540–1773",Toronto,University of Toronto Press,,,113–156,,,,9780802038616|0802038611,,,http://worldcat.org/oclc/367474071,http://www.utppublishing.com/The-Jesuits-II-Cultures-Sciences-and-the-Arts-154-1773.html,,16th century|17th century|18th century,Arts -- Art History -- Regional|History -- Regional,Europe -- Belgium -- Flanders,,,Essay originally presented as papers at a conference held in 2002.,,,,English
Book Chapter,"Mormando, Franco",2006,"Introduction: The Making of the Second Jesuit Saint: The Campaign for the Canonization of Francis Xavier, 1555–1622","Mormando, Franco|Thomas, Jill G.",Francis Xavier and the Jesuit Missions in the Far East,"Chestnut Hill, MA",The Jesuit Institute of Boston College,,,,,,,,,,http://worldcat.org/oclc/71802997,,,16th century|17th century,Saints and Blessed -- Canonization|History -- Church History|Politics,Asia|Europe -- Italy -- Rome|North America -- USA -- Massachusetts -- Boston,"Francis Xavier, Saint, 1506–1552",,"An anniversary exhibition of early printed works from the Jesuitana collection of the John J. Burns Library, Boston College.",,,,English
Book Chapter,"Morali, Ilaria",2006,Gratia ed infidelitas nella teologia di Francisco de Toledo e Francisco Suárez,,Church: Her Mission to Peoples and Nations,Rome,Editrice Pontificia Università gregoriana,,,99–150,,,,8878390704|9788878390706,,,http://worldcat.org/oclc/72439720,,,16th century|17th century,Theology -- Soteriology|Theology -- Scholasticism,Europe -- Spain,"Suárez, Francisco, 1548–1617",,,,,,Italian
Book Chapter,"Montety, H.",2006,Pierre Chaillot SJ titkos küldetése Magyarországon 1939 és 1940 között,"Szilágyi, Csaba",A magyar jezsuiták küldetése a kezdetektől napjainkig,Piliscsaba,Pázmány Péter Katolikus Egyetem Bölcsészettudományi Kar,,,677–682,,,,9639206210|9789639206212,,,http://worldcat.org/oclc/500541938,,,20th century,Biography|Politics -- War|History -- Regional,Europe -- Hungary,"Chaillet, Pierre, 1900–1972",,"Edited paper of a conference held 8–10 Nov. 2004 in Piliscsaba, Hungary.",,,,Hungarian
Book Chapter,"Meynard, Thierry",2006,The Role of Science in Contemporary China|and according to Teilhard,"Meynard, Thierry",Teilhard and the Future of Humanity,New York,Fordham University Press,,,135–156,,,,9780823237098|0823237095|0823226905|9780823226900,,,,http://fordham.bepress.com/relig/3,,20th century|21st century,Foreign Missions -- Sciences -- History of Science|Foreign Missions -- History -- Regional,Asia -- China,"Teilhard de Chardin, Pierre, 1881–1955",,,,,,English
Book Chapter,"Metz, Johann Baptist",2006,Toward a Christianity of Political Compassion,"Burke, Kevin F.|Lassalle-Klein, Robert",Love that Produces Hope: The Thought of Ignacio Ellacuría,"Collegeville, MN",Liturgical Press,,,255–279,,,,0814652174|9780814652176,,,http://worldcat.org/oclc/56510720,https://www.litpress.org/Detail.aspx?ISBN=814652174,,20th century,Political Thought|Theology -- Christian Life,North America -- El Salvador,"Ellacuría, Ignacio, 1930–1989",,,,,,English
Book Chapter,"Menegon, Eugenio",2006,Deliver Us from Evil: Confession and Salvation in Seventeenth- and Eighteenth-Century Chinese Catholicism,"Standaert, Nicolas|Dudink, Adrianus",Forgive Us Our Sins: Confession in Late Ming and Early Qing China,Sankt Augustin,Institut Monumenta Serica,,,,,,,9783805005401|3805005407,,,http://worldcat.org/oclc/79447572,,,17th century|18th century,Foreign Missions -- Inculturation|Foreign Missions -- Spirituality -- History|Foreign Missions -- Ministries -- Confession|Foreign Missions -- Anthropology,Asia -- China,,,,,,,English
Book Chapter,"McNamara, Daniel J.",2006,Reflections on Presence,"Francisco, Jose Mario C.|Jesus, Roman Miguel G. de",Science and Religion and Culture in the Jesuit Tradition: Perspective from East Asia,"Hindmarsh, Australia",ATF Press,,,125–134,,,,1920691359|9781920691356,,,http://worldcat.org/oclc/70928934,http://atfpress.com/science-and-religion-and-culture-in-the-jesuit-tradition-perspective-from-east-asia.html,,21st century,Philosophy -- Religion|Spirituality,,,,,,,,English
Book Chapter,"Mathiesen, Gaylan Kent",2006,The Jesuits: Accommodation,,A Theology of Mission: Challenges and Opportunities in Northeast Asia,Minneapolis,Lutheran University Press,,,193–232,,,,9781932688269|1932688269,,,http://worldcat.org/oclc/154677763,http://www.lutheranupress.org/Books/A-Theology-of-Mission,,16th century|17th century|18th century,Theology -- Missiology|Foreign Missions -- Accommodation -- Identity,Asia,,"Those called to proclaim the gospel in Northeast Asia face a seemingly impregnable wall of culture that is highly resistant to their message. The author tackles the question of why the great outlay of human and material resources over the centuries has not produced a greater receptivity to the gospel. He seeks answers in the theological categories of missio Dei, ecclesia Dei, and regnum Dei. Biblical, doctrinal, and theological considerations as well as church history and reformation history inform this study. 'Where does mission originate? What is God's intent for the church? As God comes into the world in love, what does his coming look like? Where does one find God's presence and how does one discern and build on that presence?' These important questions for the articulation of mission are the foci of this book.--From publisher website",,,,,English
Book Chapter,"Mata Induráin, Carlos",2006,Dos piezes dramáticas de Genaro Xavier Vallejos sobre San Francisco Xavier: Volcán de amor (1923) y Xavier. Estampas escénicas (1930),,San Francisco Xabier desde sus tierras de Navarra: Celebración del V centenario (1506–2006),Sangüesa,Grupo Cultural Enrique II de Albret,,,147–254,,,,,,,http://worldcat.org/oclc/433996423,,,20th century,Arts -- Theater -- Drama|Saints and Blessed|Literature -- Literary Criticism,,"Francis Xavier, Saint, 1506–1552",,,,,,Spanish
Book Chapter,"Martínez Millán, José",2006,La transformación de la Monarquía Hispana a finales del siglo XVI: Del modelo católico castellano al paradigma universal católico-romano,"Broggio, Paolo","Strategie politiche e religiose nel mondo moderno: La Compagnia di Gesù ai tempi di Claudio Acquaviva, 1581–1615; atti delle giornate di studi, Roma, École française de Rome, 28–29 ottobre 2002",Rome,Aracne,,,37–74,,,,8879997343|9788879997348,10.1400/89825,,http://worldcat.org/oclc/131094990,,,16th century,Politics -- Monarchy|History -- Regional,Europe -- Spain,"Sánchez, Alonso, 1547–1593|Acquaviva, Claudio, 1543–1615",,,,,,Spanish
Book Chapter,"Marschler, Thomas",2006,"Vázquez, Gabriel","Berger, David|Vijgen, Jörgen",Thomistenlexikon,Bonn,Nova et Vetera,,,690–4,,,,9783936741377|3936741379,,,http://worldcat.org/oclc/79447358,,,16th century|17th century,Theology -- Biography,Europe -- Spain,"Vázquez, Gabriel, 1551–1604",,,,,,German
Book Chapter,"Markley, Robert",2006,"China and the Limits of Eurocentric History: Milton, the Jesuits and the Jews of Kaifeng",,"The Far East and the English Imagination, 1600–1730",Cambridge; New York,Cambridge University Press,,,70–103,,,,9780521819442|052181944X,,,http://worldcat.org/oclc/62132878,http://www.cambridge.org/us/academic/subjects/literature/english-literature-17-183/far-east-and-english-imagination-16173?format=HB,,17th century|18th century,Foreign Missions -- Intercultural Dialogue|Foreign Missions -- Writings -- Relations|Foreign Missions -- History -- Regional -- Cultural History,Asia|Europe -- UK,,"In the seventeenth and eighteenth centuries China, Japan and the Spice Islands dazzled the English imagination as insatiable markets for European goods, and as vast, inexhaustible storehouses of spices and luxury wares. Robert Markley explores the significance of attitudes to the wealth and power of East Asia in rethinking conceptions of national and personal identity in seventeenth- and early eighteenth-century English literature. Alongside works by canonical English authors, this study examines the writings of Jesuit missionaries, Dutch merchants, and English and continental geographers, who directly contended with the challenges that China and Japan posed to visions of western cultural and technological superiority. Questioning conventional Eurocentric histories, Markley examines the ways in which the writings of Milton, Dryden, Defoe and Swift deal with the complexities of a world in which England was marginalized and which, until 1800, was dominated - economically at least - by the empires of the Far East.",,,,,English
Book Chapter,"Maldavsky, Aliocha",2006,The Problematic Acquisition of Indigenous Languages: Practices and Contentions in Missionary Specialization in the Jesuit Province of Peru (1568–1640),"O'Malley, John W.|Bailey, Gauvin Alexander|Harris, Steven J.|Kennedy, T. Frank","The Jesuits II: Cultures, Sciences, and the Arts, 1540–1773",Toronto,University of Toronto Press,,,602–615,,,,9780802038616|0802038611,,,http://worldcat.org/oclc/367474071,http://www.utppublishing.com/The-Jesuits-II-Cultures-Sciences-and-the-Arts-154-1773.html,,16th century|17th century,Foreign Missions -- Linguistics|Foreign Missions -- History -- Regional|Foreign Missions -- Indigenous People,South America -- Peru,,,Essay originally presented as papers at a conference held in 2002.,,,,English
Book Chapter,"Majorana, Bernadette",2006,Tra carità e cultura: Formazione e prassi misionaria nella Compagnia di Gesù,"Broggio, Paolo","Strategie politiche e religiose nel mondo moderno: La Compagnia di Gesù ai tempi di Claudio Acquaviva, 1581–1615; atti delle giornate di studi, Roma, École française de Rome, 28–29 ottobre 2002",Rome,Aracne,,,189–236,,,,8879997343|9788879997348,,,http://worldcat.org/oclc/131094990,,,16th century|17th century,Identity|Foreign Missions |Institute -- Novices -- Formation|History -- General|Generals -- Claudio Acquaviva,Europe,"Acquaviva, Claudio, 1543–1615",,,,,,Italian
Book Chapter,"Maier, Martin",2006,Karl Rahner: The Teacher of Ignacio Ellacuría,"Burke, Kevin F.|Lassalle-Klein, Robert",Love that Produces Hope: The Thought of Ignacio Ellacuría,"Collegeville, MN",Liturgical Press,,,128–143,,,,0814652174|9780814652176,,,http://worldcat.org/oclc/56510720,,,20th century,Theology -- Liberation|Theology -- Anthropology|Theology -- Sources,Europe -- Austria -- Innsbruck,"Ellacuría, Ignacio, 1930–1989|Rahner, Karl, 1904–1984",,,,,,English
Book Chapter,"Mahlmann-Bauer, Barbara",2006,Herders Balde-Ubertragungen und die Poetik der Terpsichore. Eine Reaktion auf das Programm der Horen und auf Goethes Romnische Elegien,"Burkard, Thorsten",Jacob Balde im kulturellen Kontext seiner Epoche: zur 400. Wiederkehr seines Geburtstages,Regensburg,Schnell und Steiner,,,409–463,,,,3795418127|9783795418120,,,http://worldcat.org/oclc/68629409,http://www.schnell-und-steiner.de/artikel_4956.ahtml,,17th century,Literature -- Poetry|Literature -- Literary Criticism|Literature -- Sources,Europe -- Germany,"Balde, Jakob, 1604–1668",,,,,,German
Book Chapter,"Madelin, Henri",2006,"The Personalization of the Universe; or, The Era of the Person","Meynard, Thierry",Teilhard and the Future of Humanity,New York,Fordham University Press,,,29–41,,,,9780823237098|0823237095|0823226905|9780823226900,,,,http://fordham.bepress.com/relig/3,,20th century,Theology -- Anthropology -- Person|Theology -- Cosmology,,"Teilhard de Chardin, Pierre, 1881–1955",,,,,,English
Book Chapter,"Macek, Ellen",2006,"Advice Manuals and the Formation of English Protestant and Catholic Clerical Identities, 1560–1660","Janse, Wim|Pitkin, Barbara",The Formation of Clerical and Confessional Identities in Early Modern Europe,Leiden; Boston,Brill,,,,,,,9004149090|9789004149090,,,http://worldcat.org/oclc/62500876,http://www.brill.com/dutch-review-church-history-volume-85-formation-clerical-and-confessional-identities-early modern-eu,,16th century|17th century,Controversies -- England|Spirituality -- Writings -- Manuals,Europe -- UK -- England,,,,,,,English
Book Chapter,"MacCormack, Sabine",2006,Grammar and Virtue: The Formulation of a Cultural and Missionary Program by the Jesuits in Early Colonial Peru,"O'Malley, John W.|Bailey, Gauvin Alexander|Harris, Steven J.|Kennedy, T. Frank","The Jesuits II: Cultures, Sciences, and the Arts, 1540–1773",Toronto,University of Toronto Press,,,576–601,,,,9780802038616|0802038611,,,http://worldcat.org/oclc/367474071,http://www.utppublishing.com/The-Jesuits-II-Cultures-Sciences-and-the-Arts-154-1773.html,,16th century|17th century|18th century,Foreign Missions -- Evangelization -- Strategies|Foreign Missions -- Linguistics -- Grammar|Foreign Missions -- History -- Regional,South America -- Peru,,,Essay originally presented as papers at a conference held in 2002.,,,,English
Book Chapter,"Mabry, John R.",2006,Cyberspace and the Dream of Teilhard de Chardin,"Schenk, Jim",What Does God Look Like in an Expanding Universe?,"Cincinnati, OH",ImagoEarth,,,197–208,,,,0615130798|9780615130798,,,http://worldcat.org/oclc/74492836,,,20th century,Sciences -- Astronomy|Theology -- Cosmology,,"Teilhard de Chardin, Pierre, 1881–1955",,,,,,English
Book Chapter,"Lukas, Veronika",2006,"Balde als Leser. Statius, Lucan und Vergil in der Pudicitia vindicata","Burkard, Thorsten",Jacob Balde im kulturellen Kontext seiner Epoche: Zur 400. Wiederkehr seines Geburtstages,Regensburg,Schnell und Steiner,,,13–26,,,,3795418127|9783795418120,,,http://worldcat.org/oclc/68629409,http://www.schnell-und-steiner.de/artikel_4956.ahtml,,17th century,Literature -- Poetry -- Sources -- Classics,Europe -- Netherlands,"Balde, Jakob, 1604–1668",,,,,,German
Book Chapter,"Ludlow, Morwenna",2006,'The Task of Theology Is Never Finished': John Macquarrie and Karl Rahner on the Challenges and Limits of Doing Theology,"Morgan, Robert",In Search of Humanity and Deity: A Celebration of John Macquarrie's Theology,London,SCM Press,,,,10,,,0334040493|9780334040491,,,http://worldcat.org/oclc/74215775,,,20th century,Theology -- Method|Theology -- Epistemology,Europe,"Rahner, Karl, 1904–1984",,,,,,English
Book Chapter,"Lotz, Johannes Baptist",2006,Joseph Maréchal (1878–1944),"Secretan, Philibert","La philosophie chrétienne d'inspiration catholique: Constats et controverses, positions actuelles",Fribourg,Academic Press,,,222–234,,,,2827110148|9782827110148,,,http://worldcat.org/oclc/79627894,,,20th century,Philosophy -- Metaphysics|Biography,Europe -- France,"Maréchal, Joseph, 1878–1944",,,,,,French
Book Chapter,"Löser, Werner",2006,Hans Urs von Balthasar und Ignatius von Loyola,"Kasper, Walter",Logik der Liebe und Herrlichkeit Gottes: Hans Urs von Balthasar im Gespräch; Festgabe für Karl Kardinal Lehmann zum 70. Geburtstag,Mainz,Matthias Grünewald,,,94–110,,,,9783786726012|3786726019,,,http://worldcat.org/oclc/76873651,,,20th century,Theology -- Sources|Biography|Ignatius of Loyola -- Spirituality,Europe,"von Balthasar, Hans Urs, 1905–1988|Ignatius, of Loyola, Saint, c.1491–1556",,,,,,German
Book Chapter,"Lochbrunner, Manfred",2006,Die Beziehung Hans Urs von Balthasar zum Dichter Reinhold Schneider,"Kasper, Walter",Logik der Liebe und Herrlichkeit Gottes: Hans Urs von Balthasar im Gespräch; Festgabe für Karl Kardinal Lehmann zum 70. Geburtstag,Mainz,Matthias Grünewald,,,286–317,,,,9783786726012|3786726019,,,http://worldcat.org/oclc/76873651,,,20th century,Theology -- Sources|Theology -- Systematic,Europe,"von Balthasar, Hans Urs, 1905–1988",,,,,,German
Book Chapter,"Loach, Judi D.",2006,Revolutionary Pedagogues?: How Jesuits Used Education to Change Society,"O'Malley, John W.|Bailey, Gauvin Alexander|Harris, Steven J.|Kennedy, T. Frank","The Jesuits II: Cultures, Sciences, and the Arts, 1540–1773",Toronto,University of Toronto Press,,,66–85,,,,9780802038616|0802038611,,,http://worldcat.org/oclc/367474071,http://www.utppublishing.com/The-Jesuits-II-Cultures-Sciences-and-the-Arts-154-1773.html,,16th century|17th century|18th century,Education -- Colleges -- Teaching -- Pedagogy -- History|History -- History of Education|Identity,,,,Essay originally presented as papers at a conference held in 2002.,,,,English
Book Chapter,"Lies, Lothar",2006,Das höchste Zeichen seiner Liebe (EB 289): Zur eucharistischen Sinngestalt der ignatianischen Exerzitien,"Gertler, Thomas|Kessler, Stephen C.|Lambert, Willi",Zur grösseren Ehre Gottes: Ignatius von Loyola neu entdeckt für die Theologie der Gegenwart,Freiburg im Breisgau,Herder,,,180–198,,,,9783451289446|345128944X,,,http://worldcat.org/oclc/76808973,,,16th century|17th century|18th century|19th century|20th century,Ignatius of Loyola -- Spiritual Exercises|Ignatius of Loyola -- Spirituality|Theology -- Sacraments -- Eucharist,,"Ignatius, of Loyola, Saint, c.1491–1556",,,,,,German
Book Chapter,"Lewis, Daniel K.",2006,Jesuits and the Guaranís,,A South American Frontier: The Tri-Border Region,New York,Chelsea House,,,,,,,0791086496|9780791086490,,,http://worldcat.org/oclc/62615943,,,16th century|17th century|18th century,Foreign Missions -- History -- Regional|Foreign Missions -- Ethnography|Foreign Missions -- Indigenous People -- Guaranís,South America -- Brazil|South America -- Paraguay|South America -- Argentina,,Examines the history of the Tri-Border region of South America.,,,,,English
Book Chapter,"Leonard, Ellen M.",2006,The Church & the Future: George Tyrrell Revisited,"Skira, Jaroslav Z.|Attridge, Michael S.","In God's Hands: Essays on the Church and Ecumenism in Honour of Michael A. Fahey, S.J.",Leuven,Leuven University Press,,,55–73,,,,9042918306|9789042918306|9058675750|9789058675750,,,http://worldcat.org/oclc/76942377,,,19th century|20th century,Theology -- Ecclesiology|Controversies -- Theology -- Modernism|Biography,Europe -- UK -- England,"Tyrrell, George, 1861–1909",,,,,,English
Book Chapter,"Leitão, Henrique",2006,Entering Dangerous Ground: Jesuit Teaching Astrology and Chiromancy in Lisbon,"O'Malley, John|Bailey, Gauvin Alexander|Harris, Steven J.|Kennedy, T. Frank","The Jesuits II: Cultures, Sciences and the Arts, 1540–1773","Toronto; Buffalo, NY; London",University of Toronto Press,,,371–389,,,,0802038611|9780802038616,,,http://worldcat.org/oclc/799994154,http://www.utppublishing.com/The-Jesuits-II-Cultures-Sciences-and-the-Arts-154-1773.html,,16th century|17th century|18th century,Arts -- Astrology|Arts -- Palmistry|History -- Local,Europe -- Portugal -- Lisbon,,,,,,,English
Book Chapter,"Lehmann, Karl",2006,Hans Urs von Balthasar und die Ökumene,"Kasper, Walter",Logik der Liebe und Herrlichkeit Gottes: Hans Urs von Balthasar im Gespräch; Festgabe für Karl Kardinal Lehmann zum 70. Geburtstag,Mainz,Matthias Grünewald,,,434–449,,,,9783786726012|3786726019,,,http://worldcat.org/oclc/76873651,,,20th century,Theology -- Ecumenism|Biography,Europe,"von Balthasar, Hans Urs, 1905–1988",,,,,,German
Book Chapter,"Lehmann, Karl",2006,Erinnerungen ans Hans Urs von Balthasar,"Kasper, Walter",Logik der Liebe und Herrlichkeit Gottes: Hans Urs von Balthasar im Gespräch; Festgabe für Karl Kardinal Lehmann zum 70. Geburtstag,Mainz,Matthias Grünewald,,,450–453,,,,9783786726012|3786726019,,,http://worldcat.org/oclc/76873651,,,20th century,Theology |Biography,Europe,"von Balthasar, Hans Urs, 1905–1988",,,,,,German
