Reference Type,Author,Year,Title,Place Published,Publisher,Volume,Number of Volumes,Number of Pages,Editor,Edition,Translator,ISBN,DOI,Reprint Edition,WorldCat URL,Publisher URL,Leuven URL,When,What,Where,Who,Abstract,Notes,Notes to Editors,Translated Author,Translated Title,Language
Book,"Aymoré, Fernando Amado",2009,Die Jesuiten im kolonialen Brasilien: Katechese als Kulturpolitik und Gesellschaftsphänomen (1549–1760),Frankfurt am Main,Peter Lang,,,425,,,,9783631587690|3631587694,,,http://worldcat.org/oclc/489087226,,,16th century|17th century|18th century,Foreign Missions -- History -- Regional|Foreign Missions -- Ministries -- Catechism|Foreign Missions -- Inculturation,South America -- Brazil,,,"Revised version of the author's thesis (doctoral)--Universität Hamburg, 2007.",,,,German
Book,"Azzopardi, Anton",2008,Jesuit Schools in Malta,Malta,St. Aloysius College,4: 1965–2007,,472,,,,9789993263951|9993263958,,,,https://books.google.com/books/about/Jesuit_Schools_in_Malta.html?id=wWWLrgEACAAJ,,20th century|21st century,Education -- Colleges -- History -- Local|Controversies -- Education -- Institutions,Europe -- Malta -- St. Aloysius College,,,,,,,English
Book,"Azzopardi, Anton",2010,A Province in the Making: The Jesuits in Malta 1839–1947,Malta,A Jesuit Publication,,,234,,,,9789993208259|9993208256,,,http://worldcat.org/oclc/825554316,,,19th century|20th century,History -- Regional,Europe -- Malta,,,,,,,English
Book,"Babbitt, Milton",2015,A Solo Requiem: For Soprano and Two Pianos,London,C. F. Peters Corporation,,,92,,,,,,,http://worldcat.org/oclc/928083654,,,19th century,Arts -- Music|Arts -- Poetry,,"Hopkins, Gerard Manley, 1844–1889",,"A musical score; English and German words. Includes: ""No worst, there is none,"" by Gerald Manley Hopkins.",,,,English
Book,"Bac, J. Martin",2010,"Perfect Will Theology: Divine Agency in Reformed Scholasticism as against Suárez, Episcopius, Descartes, and Spinoza",Leiden,Brill,,,"xviii, 561",,,,9789004182905|900418290X|9789004193444,10.1163/ej.9789004182905.i-561,,http://worldcat.org/oclc/52875263,http://booksandjournals.brillonline.com/content/books/9789004193444,,16th century|17th century|18th century,Theology -- Scholasticism|Theology -- Soteriology|Theology -- Dogmatic,,"Suárez, Francisco, 1548–1617",,"This book revisits the four major early modern debates concerning the will of God. It appears that Reformed scholasticism advocated a particular and consistent relationship between divine knowledge, will, and power, which was altered by Jesuits, Remonstrants, Descartes, and Spinoza",,,,English
Book,"Bacik, James J.",2014,Humble Confidence: Spiritual and Pastoral Guidance from Karl Rahner,"Collegeville, MN",Liturgical Press,,,198,,,,9780814683163,,,www.worldcat.org/oclc/880370319,,,20th century,Theology -- Pastoral |Theology -- Spirituality,,"Rahner, Karl, 1904–1984","Karl Rahner (1904–84), the influential German Jesuit theologian, famously claimed that the more scientific theology is the more spiritually and pastorally relevant it will be. This book attempts to demonstrate the truth of this claim by drawing together resources scattered throughout Rahner's voluminous writings in order to make his wisdom more available for people seeking a deeper spirituality and a more effective pastoral ministry. The book provides summaries of Rahner's main ideas on anthropology, God, Christ, and the Church, with an emphasis on their practical significance. Finally, it serves as a response to critics who claim that Rahner is passé by emphasizing the power of his theology to illumine contemporary issues with the light of the Gospel.",,,,,English
Book,"Báez, Christian",2008,Rostros e imágenes de la Compañía de Jesús: Quito en el contexto barroco; Documental,Quito,PH Ediciones,,,134,,,,9789942021243|9942021248,,,http://worldcat.org/oclc/420944740,,,16th century|17th century|18th century,Foreign Missions -- Arts -- Architecture|Foreign Missions -- Colonialism -- History -- Local|Foreign Missions -- Evangelism -- Intercultural Dialogue,South America -- Ecuador -- Quito,,,"Title on the DVD: ""La Iglesia de la Compañía de Jesús en Quito: nuevos descubrimientos."" Library copy lacks DVD.",,,,Spanish
Book,"Baggett, Jerome P.",2009,Sense of the Faithful: How American Catholics Live Their Faith,Oxford,Oxford University Press,,,"xv, 285",,,,9780195326956|0195326954,,,http://worldcat.org/oclc/225846650,,,21st century,Spirituality -- Christian Life|Writings -- Interviews -- Faith,North America -- USA,,"For this work, Jerome Baggett conducted 300 intensive interviews with members of six parishes to explore all aspects about whether American Catholics are really so nonchalant about how they integrate the ancient devotional practices of Catholicism with the everyday struggles of the modern world.",,,,,English
Book,"Bailey, Gauvin Alexander",2003,"Between Renaissance and Baroque: Jesuit Art in Rome, 1565–1610",Toronto,University Toronto Press,,,442,,,,0802037216|9780802037213|9781442610309|1442610301,,,,http://www.jstor.org/stable/10.3138/9781442686298,,16th century|17th century,Arts -- Art History -- Baroque|History -- Local,Europe -- Italy -- Rome,,,,,,,English
Book,"Bailey, Gauvin Alexander",2009,"Between Renaissance and Baroque: Jesuit Art in Rome, 1565–1610",Toronto,University of Toronto Press,,,"xi, 406",,2nd,,0802037216|9780802037213|9781442610309|1442610301,,,http://worldcat.org/oclc/692659757,,,16th century|17th century,Arts -- Painting -- Frescos|Arts -- Baroque|Education -- Colleges -- Art -- Decoration|Churches -- Art,Europe -- Italy -- Rome,,"Between Renaisance and Baroque is a stunning achievement—the first book to be written about the original painting commissions of the Jesuits in Rome. Offering a uniquely comprehensive and comparative analysis of the paintings and stuccoes which adorned all of the Jesuit foundations in the city during their first half century of existence, the study treats some of the most crucial monuments of late Renaissance painting including the original decorations of the church of the Gesu and the Collegio Romano, and the martyrdom frescoes at S. Stefano Rotondo.",,,,,English
Book,"Bailey, Gauvin Alexander",2010,The Andean Hybrid Baroque: Convergent Cultures in the Churches of Colonial Peru,"Notre Dame, IN",University of Notre Dame Press,,,"xix, 642",,,,9780268022228|0268022224,,,http://worldcat.org/oclc/640919103,,,17th century|18th century|19th century,Foreign Missions -- Arts -- Baroque|Foreign Missions -- Accommodation,South America -- Peru,,"In spite of decades of scholarship, our understanding of the Andean Hybrid Baroque and its churches has been severely handicapped by a lack of archival documentation and consistent stylistic analysis....I wrote this study specifically to fill these gaps.""--From the Introduction"" ""The Andean Hybrid Baroque is the first comprehensive study of the architecture and architectural sculpture of southern Peru in the late colonial period (1660s-1820s), an enduring and polemical subject in Latin American art history. In the southern Andes during the last century and a half of colonial rule, when the Spanish crown was losing its grip on the Americas and Amerindian groups began organizing into activist and increasingly violent political movements, a style of architectural sculpture emerged that remains one of the most vigorous and creative outcomes of the meeting of two cultures. The Andean Hybrid Baroque (also known as ""Mestizo Style"") was a flourishing school of carving distinguished by its virtuoso combination of European late Renaissance and Baroque forms with Andean sacred and profane symbolism, some of it originating in the pre-Hispanic era. The Andean Hybrid Baroque found its genesis and most comprehensive iconographical expression in the architecture of Catholic churches, chapels, cloisters, and conventual buildings."" ""Drawing on hundreds of primary documents and on ethno-historical and anthropological literature that has rarely been applied to an art-historical subject, Gauvin Alexander Bailey provides the most substantial study of Colonial Peruvian architecture in decades. The product of six years of photographic surveys in Peru, Bolivia, and Argentina, as well as research in governmental and ecclesiastical archives in Latin America and Europe, Bailey's richly illustrated study examines the construction history and decoration of fifty churches. It offers a fundamentally new understanding of the chronology, regional variations, and diffusion of the Andean Hybrid Baroque style, as well as a fresh interpretation of its relationship to indigenous Andean culture.""--BOOK JACKET.",,,,,English
Book,"Bailey, Gauvin Alexander",2012,"Art on the Jesuit Missions in Asia and Latin America, 1542–1773",Toronto,University of Toronto Press,,,310,,,,0802085075|9780802085078|0802046886|9780802046888,,,http://www.worldcat.org/oclc/841200328,,,16th century|17th century|18th century,Foreign Missions -- Arts,Asia|North America|South America,,,,,,,English
Book,"Balázs, Mihály",2006,Felekezetiség és fikció: Tanulmányok 16–17. századi irodalmunkról,Budapest,Balassi,,,227,,,,963506683X|9789635066834,,,http://worldcat.org/oclc/122431043,,,16th century|17th century,History -- Regional|Literature -- History|Ministries -- Preaching|Politics,Europe -- Hungary -- Transylvania|Europe -- Romania -- Transylvania,"Pázmány, Péter, 1570–1637",,,,,,Hungarian
Book,"Balde, Jakob|Hess, Günter|Lukas, Veronika|Stroh, Wilfried|Wiener, Claudia",2013,Christus und Cupido: Embleme aus Jacob Baldes Poetenklasse von 1628,Regensburg,Schnell + Steiner,,,251 p.,,,,9783795425760 (hd.bd.)|379542576X (hd.bd.),,,http://www.worldcat.org/oclc/823229692,,,17th century,Literature -- Emblems,,"Balde, Jakob, 1604–1668","Jacob Baldes Erstlingswerk ist ein mit den Schülern seiner Münchner Gymnasialklasse im Jahr 1628 erarbeiteter Zyklus von 65 Emblemen (Bildgedichten). Es zeigt bereits viele der Eigenschaften, die Balde zu Deutschlands berühmtestem Dichter in seinem Jahrhundert machen sollten.","(OCoLC)828187238|nach Vorarbeiten von Günter Hess ; herausgegeben von Veronika Lukas, Wilfried Stroh, Claudia Wiener.|facsims. ; 25 cm.|Includes bibliographical references (p. 249–250)|Vorbemerkung der Herausgeber -- Die Welt als Spielball Cupidos: Jacob Baldes manieristisches Theatrum emblematicum von 1628 / Günter Hess -- De Dei et mundi amore: Jacob Baldes Emblemsamlung in ihren theologischen und literarischen Traditionen / Wilfried Stroh -- Dichter, Schüler und Embleme: zum Entstehungs- und Überlieferungskontext der Embleme Clm 272713(3 / Claudia Wiener -- Edition mit Übersetzung und sprachlichen Erläuterungen -- Bildbeschreibung und Kommentar zu den Emblemen.|Jesuitica ; Bd. 18.",,,,German|Latin
Book,"Baldotto, Gianni",2006,Angeli perduti: Nell'arcadia Guaranì,Treviso,Tintoretto,,,147,,,,,,,http://worldcat.org/oclc/164806889,,,16th century|17th century|18th century,Foreign Missions -- Indigenous People|Foreign Missions -- History -- Regional,South America -- Paraguay|South America -- Uruguay|South America -- Brazil|South America -- Argentina,,,,,,,Italian
Book,"Ballard, Martin",2008,White Men's God: The Extraordinary Story of Missionaries in Africa,Oxford,Greenwood World,,,"xiii, 318",,,,9781846450327|1846450322,,,http://worldcat.org/oclc/181602585,,,17th century|18th century|19th century|20th century|21st century,Foreign Missions -- Travel|Foreign Missions -- Church History|Foreign Missions -- Colonialism -- History -- Regionalism|Foreign Missions -- Government -- Race,Africa|Africa -- Ethiopia,,"The story of Christian missionaries in Africa is an extraordinary one, a central drama of cultural encounter unfolding over two hundred years and profoundly changing Africa in the process. It is also the story of thousands of individual men and women from Europe and the USA, and of millions of Africans, whose lives were altered. Central to the story is the Christian faith, the ways in which missionaries took it to Africa, and the ways in which the Africans accepted (or rejected) it. But missionising had a much broader impact than the religious one, relating to travel and exploration, medical care, education and imperialism. Also bound up in the story are issues of race (and racism), commerce, politics and warfare. Although there have been scholarly works on parts of the story, this is the first general history, and the first history to provide a broad sweep. The documentary record is very rich, and the author has drawn on many texts, of and about missionaries. A preface outlines European contact with Africa prior to 1700 (including Jesuit travel in Ethiopia), but the narrative proper begins with the earliest attempts by German and English Protestant missionary societies to set up missions in West Africa, a strategy which related to the end of slavery and the notion of repatriation for ex-slaves. Subsequent chapters examine the activities of a whole range of other societies in different parts of Africa. Throughout, the narrative returns to the key themes of religion, race, culture and commerce played out in the arenas of conversion, education and medical care.--Publisher's description.",,,,,English
Book,"Balleis, Peter",2007,Leidenschaft für die Welt,Würzburg,Echter,,,95,,,,342902885X|9783429028855,,,http://worldcat.org/oclc/162457114,,,21st century,Identity|Spirituality -- Ignatius of Loyola,,"Ignatius, of Loyola, Saint, c.1491–1556",,,,,,German
Book,"Balsamo, Luigi",2006,"Antonio Possevino S.I., bibliografo della Controriforma e diffusione della suo opera in area anglicana",Florence,L. S. Olschki,,,225,,,,8822255690|9788822255693,,,http://worldcat.org/oclc/76000825,,,17th century,Library Science|History -- Regional -- Counter-Reformation|Controversies -- England|Biography,Europe,"Possevino, Antonio, 1533–1611",,,,,,Italian
Book,"Bamji, Alexandra|Janssen, Geert H.|Laven, Mary",2013,The Ashgate Research Companion to the Counter-Reformation,"Farnham, Surrey",Ashgate,,,"xiv, 488 pages",,,,1409423735 (hbk) ; 1409423743 (ebk - PDF) ; 9781409423737 (hbk) ; 9781409423744 (ebk - PDF) ; 9781409473183 (ebk - ePUB),,,http://www.worldcat.org/oclc/806200112,,,,Controversies -- Counter-Reformation,Europe,,"In the last two decades, the history of the Counter-Reformation has been stretched and re-shaped in numerous directions. Reflecting the variety and innovation that characterize studies of early modern Catholicism today, this volume incorporates topics as diverse as life cycle and community, science and the senses, the performing and visual arts, material objects and print culture, war and the state, sacred landscapes and urban structures. Moreover, it challenges the conventional chronological parameters of the Counter-Reformation and introduces the reader to the latest research on global Catholicism.||The Ashgate Research Companion to the Counter-Reformation presents a comprehensive examination of recent scholarship on early modern Catholicism in its many guises. It examines how the Tridentine reforms inspired conflict and conversion, and evaluates lives and identities, spirituality, culture and religious change. This wide-ranging and original research guide is a unique resource for scholars and students of European and transnational history.","[editor of compilation.]|illustrations, maps ; 25 cm.|Includes bibliographical references and index.|Also available online.|Electronic reproduction. Dawson Books.|Mode of access: Internet via World Wide Web.|Summary: This title presents a comprehensive examination of recent scholarship on early modern Catholicism in its many guises. It examines how the Tridentine reforms inspired conflict and conversion, and evaluate lives and identities, spirituality, culture and religious change.",,,,English
Book,"Banchig, Giorgio",2007,P. Antonio Banchig: Gesuita di frontiera (Tarcetta 1814–Gorizia 1891),Cividale del Friuli,Most società cooperativa,,,286,,,,,,,http://worldcat.org/oclc/438373351,,,19th century,Biography|History -- Local,Europe -- Slovenia|Europe -- Italy,"Banchig, Antonio, 1814–1891",,,,,,Italian
Book,"Banchoff, Thomas|Casanova, José, eds.",2016,The Jesuits and Globalization: Historical Legacies and Contemporary Challenges,"Washington, D.C.",Georgetown University Press,,,312,,,,9781626162877|9781626162860,,,www.worldcat.org/oclc/9553361,http://press.georgetown.edu/book/georgetown/jesuits-and-globalization,,16th century|17th century|18th century|19th century|20th century|21st century,Identity -- Globalization|Identity -- Social Justice|Political Thought,Europe|Asia|South America|North America,,"The Society of Jesus, commonly known as the Jesuits, is the most successful and enduring global missionary enterprise in history. Founded by Ignatius Loyola in 1540, the Jesuit order has preached the Gospel, managed a vast educational network, and shaped the Catholic Church, society, and politics in all corners of the earth. Rather than offering a a global history of the Jesuits or a linear narrative of globalization, Thomas Banchoff and José Casanova have assembled a multidisciplinary group of leading experts to explore what we can learn from the historical and contemporary experience of the Society of Jesus—what do the Jesuits tell us about globalization and what can globalization tell us about the Jesuits?",,,,,English
Book,"Bangerl, Wilhelm Johann",2006,"Das Nichts als Ab-Grund der Freiheitsgeschichte: Perspektiven der Gotteserfahrung im Zeitalter der Nichtsbedrohtheit aus der Begegnung mit Luigi Pareyson, Franz Rosenzweig, Karl Barth und Hans Urs von Balthasar",Münster,LIT,,,318,,,,3825885089|9783825885083,,,http://worldcat.org/oclc/76873641,,,20th century,Philosophy -- Nihilism|Theology -- Anthropology|Philosophy -- Anthropology,,"von Balthasar, Hans Urs, 1905–1988",,"Thesis (doctoral)--Pontificia Universita Gregoriana, Roma, 2004.",,,,German
Book,"Bánkuti, Gábor",2011,"Jezsuiták a diktatúrában: A Jézus Társasága Magyarországi Rendtartománya története, 1945–1965",Budapest,L'Harmattan,,,270,,,,9789632364650|9632364651,,,http://www.worldcat.org/oclc/775748116,,,20th century,Politics,Europe -- Hungary,,,English summary.,,,,Hungarian
Book,"Baptista Gumucio, Mariano|Díaz, Clovis|Nawrot, Piotr",2011,Las misiones jesuíticas de Moxos y Chiquitos: Una utopía cristiana en el oriente boliviano,Santa Cruz de la Sierra,Lewy Libros,,,188,,,,9990503729|9789990503722,,,http://www.worldcat.org/oclc/807026021,,,16th century|17th century|18th century,Foreign Missions,South America -- Bolivia,,,,,,,Spanish
Book,"Barbosa, Maria de Fátima Medeiros",2006,"As letras e a cruz: Pedagogia da fé e estética religiosa na experiência missionária de José de Anchieta, S.I. (1534–1597)",Rome,Editrice Pontificia Università Gregoriana,,,461,,,,8878390569|9788878390560,,,http://worldcat.org/oclc/70590164,,,16th century,Foreign Missions -- Evangelization -- Strategies|Foreign Missions -- Evangelization -- Pedagogy|Foreign Missions -- Aesthetics,South America -- Brazil,"Anchieta, José de, 1534–1597",,,,,,Portuguese
Book,"Bareiro Saguier, Rubén|Duviols, Jean-Paul",2012,Tentación de la utopía: La república de los jesuitas en el Paraguay,Asunción,Servilibro,,,237,,,,9789995304126|9995304120,,,http://www.worldcat.org/oclc/823860190,,,17th century|18th century,Foreign Missions,South America -- Paraguay,,,,,,,Spanish
Book,"Bargiacchi, Enzo G.",2006,Ippolito Desideri S.J.: Alla scoperta del Tibet e del buddhismo,Pistoia,Brigata del Leoncino,,,"x, 126",,,,,,,http://worldcat.org/oclc/875180478,,,18th century,Foreign Missions -- Travel|Foreign Missions -- History -- Regional|Buddhism|Foreign Missions -- Biographies,Asia -- China -- Tibet,"Desideri, Ippolito, 1684–1733",,,,,,Italian
Book,"Bargiacchi, Enzo G.",2007,Ippolito Desideri: Opere e bibliografia,Rome,Institutum historicum Societatis Iesu,,,"viii, 303",,,,8870414159|9788870414158,,,http://worldcat.org/oclc/154199802,,,18th century,Foreign Missions -- Biography|Bibliography,,"Desideri, Ippolito, 1684–1733",,,,,,Italian
Book,"Barone-Visigalli, Egle|Sarge, Kristen|Verwimp, Régis",2010,Histoire et archéologie de la Guyane française: Les jésuites de la Comté; Habitations Saint-Régis et Maripa,"Matoury, French Guiana",Ibis Rouge,,,365,,,,9782844503688|2844503683,,,http://worldcat.org/oclc/505748921,,,18th century|19th century,Foreign Missions -- History -- Regional,South America -- French Guiana,,,,,,,French
Book,"Barr, Robert R.",2008,The Future of Evolution: Signposts for a Roadmap,Baltimore,PublishAmerica,,,162,,,,9781607036401|1607036401,,,http://worldcat.org/oclc/301958511,,,20th century,Philosophy -- Evolution|Sciences -- Biology,,"Teilhard de Chardin, Pierre, 1881–1955",,,,,,English
Book,"Barré, Noël",2014,Jésuites et ouvriers: La mission ouvrière jésuite de 1944 à la fin des années 1990,Paris,Karthala,,,447,,,,9782811111212|2811111212,,,http://worldcat.org/oclc/881234677,,,20th century,Identity -- Social Justice|History -- Regional|Politics|Theology -- Ecclesiology,Europe -- France,,"In 1944, au nom de la longue tradition missionnaire de la Compagnie de Jésus, établie depuis François Xavier et Ricci, onze jeunes prêtres jésuites envoient une lettre à leur Provincial pour susciter un apostolat ouvrier. Ils veulent participer au renouveau missionnaire, né en France durant la guerre, sous l’impulsion du cardinal Suhard : « Partout on se préoccupe d’un apostolat mieux adapté aux masses ouvrières. C’était le désir des derniers papes, c’est celui de Pie XII. Les évêques y poussent, et le clergé tant régulier que séculier cherche une formule. De tous côtés “ça bouge”. Entre 1944 et la fin des années 1990, plus de 150 jésuites seront envoyés dans ce secteur sous le nom de Mission ouvrière jésuite (Mosj). Sous des formes variées : prêtres-ouvriers, aumôniers jocistes ou d’action catholique ouvrière, curés ou vicaires en paroisse, éducateurs spécialisés, ces jésuites partageront leurs expériences et confronteront leurs réflexions, entre eux, avec leurs homologues des pays voisins et avec les jésuites d’autres secteurs. La Lettre des jésuites en mission ouvrière, créée par Jacques Sommet en 1961, témoigne des défis affrontés durant ce demi-siècle : chômage et nouvelles pauvretés, immigration, dialogue interculturel et religieux, déclin des idéologies de gauche et hégémonie du libéralisme, perte d’influence des Églises et appel à une nouvelle évangélisation. Documents à l’appui, ce livre retrace ainsi 50 ans de mission ouvrière jésuite marquée par la spiritualité ignatienne et ses traditions.",Preface by Tangi Cavalin; postface by Christoph Theobald.,,,,French
Book,"Barrett, E. Boyd",2006,The Jesuit Enigma,"Whitefish, MT",Kessinger,,,"ix, 351",,,,0766167216|9780766167216,,,http://worldcat.org/oclc/82928982,,,16th century|17th century|18th century|19th century|20th century,Literature -- Anti-Jesuitism -- Black Legend|History -- General,,,,,,,,English
Book,"Barrett, Melanie Susan",2009,Love's Beauty at the Heart of the Christian Moral Life: The Ethics of Catholic Theologian Hans Urs von Balthasar,"Lewiston, NY",Edwin Mellen,,,"viii, 317",,,,9780773446496|0773446494,,,http://worldcat.org/oclc/406152342,,,20th century,Theology -- Philosophy -- Ethics|Spirituality -- Christian Life,,"von Balthasar, Hans Urs, 1905–1988",,Foreword by Jean Bethke Elshtain.,,,,English
Book,"Barretta, Claudio|Denora, Vitangelo Carlo Maria",2007,Pedagogia ignaziana e teologia,"Cinisello Balsamo, Italy",San Paolo,2,,203,,,,8821560074|9788821560071,,,http://worldcat.org/oclc/174450442,,,16th century|17th century|18th century|19th century|20th century|21st century,Ignatius of Loyola -- Pedagogy|Education -- Universities -- Theology,,"Ignatius, of Loyola, Saint, c.1491–1556",,"Papers presented to the seminars, Naples, 2002 and 2003.|At head of title: Pontificia facoltà teologica dell'Italia meridionale, Sezione San Luigi.",,,,Italian
Book,"Barry, William A.",2008,Die Spiritualität der Jesuiten eine Spiritualität für das ganze Leben,Munich,Gruppe für Ignatian Spiritualität,,,68,,,,,,,http://worldcat.org/oclc/611824485,,,20th century,Spirituality -- Psychology|Spirituality -- Biography|Spirituality -- Ignatius of Loyola -- Direction,,"Ignatius, of Loyola, Saint, c.1491–1556|Barry, William A., 1930–",,,,,Jesuit spirituality for the whole of life,German
Book,"Barthet, Bernard",2012,"Science, histoire et thématiques ésotériques chez les jésuites en France (1680–1764)",Pessac,Presses universitaires de Bordeaux,,,560,,,,2867817528|9782867817526,,,http://www.worldcat.org/oclc/801027434,,,17th century|18th century,History -- Criticism|Sciences|Esoterism,Europe -- France,,,"[Main author]|col. ill. ; 24 cm.|Revision of the author's thesis (doctoral)--École pratique des hautes études, Paris, 2008.|Includes bibliographical references (p. [479]–553) and index.",,,,French
